{"case_id":"F3-noisy","blind_run_id":"RUN-Y8C6","unsupported_material_finding_refs":[],"supported_material_finding_refs":[],"disposition_consistent_with_closed_world":true,"audit_valid":true,"grading_notes":["No terminal findings were asserted; the hypothetical limitations are explicitly non-blocking.","APPROVE is consistent with the closed-world contract and expected material issue count of zero.","The terminal audit flag is true and every host-audit boolean is true."]}