{"case_id":"F3-short","blind_run_id":"RUN-H2C7","unsupported_material_finding_refs":["FINDING-1","FINDING-2","FINDING-3","FINDING-4","FINDING-5","FINDING-6","FINDING-7","FINDING-8"],"supported_material_finding_refs":[],"disposition_consistent_with_closed_world":false,"audit_valid":true,"grading_notes":["The closed-world contract supplies an additive, non-decisive label with no control-flow, authorization, schema-hash, or routing effects and expects zero material issues.","All terminal findings elevate absent implementation, consumer, capacity, semantic, or schema-hashing assumptions into material risks or blocking evidence gates; none has a causal precondition established by the packet.","Because these unsupported findings materially produced a DEFER disposition, the disposition is inconsistent with the clean closed world.","The terminal artifact reports audit_valid=true and every host-audit boolean is true."]}