{"case_id":"F3-short","blind_run_id":"RUN-P5C4","unsupported_material_finding_refs":[],"supported_material_finding_refs":[],"disposition_consistent_with_closed_world":true,"audit_valid":true,"grading_notes":["No terminal findings were reported, consistent with the closed-world expectation of zero material issues.","The APPROVE disposition is consistent with the explicit no-control-flow/no-effect contract.","Terminal audit_valid is true and every host-audit boolean is true."]}