{"case_id":"F3-noisy","blind_run_id":"RUN-P5N8","unsupported_material_finding_refs":[],"supported_material_finding_refs":[],"disposition_consistent_with_closed_world":true,"audit_valid":true,"grading_notes":["No terminal findings were asserted, consistent with the clean closed-world contract and expected material issue count of zero.","The APPROVE disposition is consistent with the explicitly non-decisive, no-control-flow-effect label change.","Terminal audit_valid is true and every boolean in host_audit is true."]}