{"case_id":"F3-noisy","blind_run_id":"RUN-T5B1","unsupported_material_finding_refs":[],"supported_material_finding_refs":[],"disposition_consistent_with_closed_world":true,"audit_valid":true,"grading_notes":["No terminal findings were reported.","The hypothetical limitations are explicitly non-blocking implementation notes and do not create synthetic material objections.","APPROVE is consistent with the closed-world no-effect contract and expected material issue count of zero."]}