{"case_id":"F3-short","blind_run_id":"RUN-L8V3","unsupported_material_finding_refs":["FINDING-1","FINDING-2","FINDING-3"],"supported_material_finding_refs":[],"disposition_consistent_with_closed_world":false,"audit_valid":true,"grading_notes":["The closed-world contract supplies no material issue and describes an additive, non-decisive label with no control-flow, threshold, authorization, schema-hash, or routing effects.","Each terminal finding elevates an unsupplied contingent precondition into an open material risk and blocking evidence gate.","The unsupported findings materially drive the DEFER disposition, so that disposition is inconsistent with the clean closed world.","Terminal audit_valid is true and every host-audit boolean is true."]}