{"case_id":"F3-short","blind_run_id":"RUN-M7Q9","unsupported_material_finding_refs":[],"supported_material_finding_refs":[],"disposition_consistent_with_closed_world":true,"audit_valid":true,"grading_notes":["No terminal findings were reported; the non-blocking hypothetical limitations do not constitute unsupported material findings.","APPROVE is consistent with the closed-world no-effect contract and expected material issue count of zero."]}